name,category,address,city,state,zip,phone,website,description,interstate,exitnumber,showers,food,fuel,laundry,restrooms,repair,catscale,wifi,security
Love's Travel Stop #379,truck-stops,3204 SE County Road 255,Lee,FL,32059,850-971-4115,https://www.loves.com/,"Full-service Love's travel center directly off I-10 at the Lee/US-90 exit with fuel lanes, showers, a CAT scale and truck service bays.",I-10,262,yes,yes,yes,,yes,yes,yes,yes,
Busy Bee #25 Travel Plaza,truck-stops,6468 US Highway 129,Live Oak,FL,32060,386-487-2935,,"Popular independent Busy Bee travel plaza at the I-10/US-129 interchange with fuel lanes, showers, laundry, a CAT scale and a convenience store with quick-service food.",I-10,283,yes,yes,yes,yes,yes,,yes,yes,
Penn Oil - Live Oak,parking,6458 US Highway 129,Live Oak,FL,32060,386-362-2948,,Independent fuel and truck-parking stop at the I-10/US-129 interchange with a store and deli food.,I-10,283,,yes,yes,,yes,,,,
Pilot Travel Center #087,truck-stops,1050 US 301 South,Baldwin,FL,32234,904-266-4238,https://locations.pilotflyingj.com/,"Pilot travel center off I-10 at the US-301 Baldwin exit with diesel lanes, showers, a Subway, laundry and a CAT scale.",I-10,343,yes,yes,yes,yes,yes,,yes,yes,
TA Baldwin Travel Center,truck-stops,1024 US 301 South,Baldwin,FL,32234,904-266-4281,https://www.ta-petro.com/,"TravelCenters of America full-service stop off I-10 at Baldwin with showers, laundry, a Country Pride restaurant and Arby's, and overnight truck parking.",I-10,343,yes,yes,yes,yes,yes,yes,,,
Jimmies Truck Stop,truck-stops,6375 S State Road 53,Madison,FL,,850-973-2973,,"Independent truck stop at the I-10/SR-53 Madison exit with a restaurant, store, showers, laundry and on-site repair.",I-10,258,yes,yes,yes,yes,yes,yes,,,
Johnson & Johnson Truck Stop,truck-stops,6332 S State Road 53,Madison,FL,,850-973-4735,,Independent fuel stop and store at the I-10/SR-53 Madison exit with deli food and truck parking.,I-10,258,,yes,yes,,yes,,,,
Exxon Truck Parking - Macclenny,parking,1710 S 6th St,Macclenny,FL,,904-259-8292,,Fuel station with a store and truck parking at the I-10/FL-121 Macclenny exit.,I-10,335,,,yes,,yes,,,,
S & S Food Store - Lake City,truck-stops,3519 N US Highway 441,Lake City,FL,,,,Independent fuel and truck-parking stop with a store and deli at the I-10/US-441 Lake City exit.,I-10,303,,yes,yes,,yes,,,,
