name,category,address,city,state,zip,phone,website,description,interstate,exitnumber,showers,food,fuel,laundry,restrooms,repair,catscale,wifi,security
Love's Travel Stop #463,truck-stops,3158 I-10 W,Seguin,TX,78155,830-372-6190,https://www.loves.com/,"A 24-hour Love's travel stop on I-10 in Seguin with truck fueling, an on-site Love's Truck Tire Care center, and a CAT scale.",I-10,604,yes,yes,yes,,yes,yes,yes,yes,
Love's Travel Stop #264,truck-stops,190 US Highway 90,Luling,TX,78648,830-875-5667,https://www.loves.com/,A 24-hour Love's travel stop at the I-10/US-90 junction in Luling offering diesel fueling and driver amenities.,I-10,632,yes,yes,yes,,yes,,,yes,
Flatonia Travel Center,truck-stops,,Flatonia,TX,78941,,,"An independent Shell-branded travel center at the I-10 Exit 661 (Hwy 95) junction in Flatonia with truck parking, fuel lanes, showers and on-site food.",I-10,661,yes,yes,yes,,yes,,,,
Columbus Travel Center,truck-stops,4800 I-10,Columbus,TX,,979-733-0000,,"An independent Shell travel center on I-10 in Columbus with 24-hour diesel, truck parking, showers and quick-service food.",I-10,698,yes,yes,yes,,yes,,,yes,
Sealy Truck Stop,truck-stops,5058 NW I-10 Frontage Rd,Sealy,TX,77474,,,"An independent truck stop on the I-10 frontage road in Sealy offering a large truck parking lot, drivers' lounge and on-site restaurant/deli.",I-10,716,,yes,yes,,yes,,,,
TravelCenters of America - Sealy,truck-stops,6701 US Hwy 90,Sealy,TX,77474,979-732-2986,https://www.ta-petro.com/,"A 24-hour TA travel center near Sealy (Bernardo) off I-10 with Shell diesel, overnight truck parking, showers and laundry.",I-10,709,yes,yes,yes,yes,yes,,yes,,
TravelCenters of America - San Antonio,truck-stops,6170 I-10 East,San Antonio,TX,78219,,https://www.ta-petro.com/,"A 24-hour TA travel center on the east I-10 corridor in San Antonio (Foster Rd) with truck fueling, repair bays, showers and a restaurant.",I-10,583,yes,yes,yes,,yes,yes,yes,,
Petro Stopping Center - San Antonio,truck-stops,1112 Ackerman Rd,San Antonio,TX,78219,210-661-9416,https://www.ta-petro.com/,"A large 24-hour Petro (TA) stopping center off I-10 at Ackerman Road in San Antonio with truck service bays, an Iron Skillet restaurant, showers and diesel.",I-10,581,yes,yes,yes,yes,yes,yes,yes,,
