name,category,address,city,state,zip,phone,website,description,interstate,exitnumber,showers,food,fuel,laundry,restrooms,repair,catscale,wifi,security
Love's Travel Stop #776,truck-stops,700 Ceres Blvd,Vicksburg,MS,39183,601-636-6088,https://www.loves.com/,"24-hour Love's Travel Stop at the Ceres Boulevard exit east of Vicksburg with truck fueling, showers, an Arby's, and a CAT scale.",I-20,15,yes,yes,yes,,yes,yes,yes,yes,
Speedco at Love's #776 - Vicksburg,roadside-service,700 Ceres Blvd,Vicksburg,MS,39183,800-655-6837,,"Speedco lube, oil, light-mechanical and tire service bays located at the Love's Travel Stop off I-20 Exit 15.",I-20,15,,,,,,yes,,,
Petro Jackson (TA/Petro Stopping Center #328),truck-stops,970 I-20 W Frontage Rd,Jackson,MS,39201,601-292-0940,https://www.ta-petro.com/,"Full-service Petro travel center on the I-20/I-55 concurrency with an Iron Skillet restaurant, showers, laundry, service bays and a CAT scale.",I-20,45,yes,yes,yes,yes,yes,yes,yes,yes,
Pilot Travel Center #77,truck-stops,2520 S Gallatin St,Jackson,MS,39204,601-968-9491,https://locations.pilotflyingj.com/,"Pilot Travel Center on the I-20/I-55 concurrency with a McDonald's, showers, laundry, Wingfoot truck care and a CAT scale.",I-20,45,yes,yes,yes,yes,yes,yes,yes,yes,
Love's Travel Stop #420,truck-stops,730 Highway 80 E,Flowood,MS,39232,601-420-8324,https://www.loves.com/,"Love's Travel Stop just east of the I-20/I-55 split in Flowood with truck parking, showers, Subway/Chester's, and a CAT scale.",I-20,47B,yes,yes,yes,,yes,,yes,yes,
SOS Truck Stop,truck-stops,,Clinton,MS,39056,,,"Independent truck stop at the Clinton exit of I-20 offering diesel, showers and an ATM.",I-20,35,yes,,yes,,yes,,,,
RD's Road Service - Vicksburg,roadside-service,,Vicksburg,MS,,601-208-0268,,"Mobile 24-hour truck tire change, fuel delivery and roadside repair service covering the I-20 corridor around Vicksburg.",I-20,,,,,,,yes,,,
