name,category,address,city,state,zip,phone,website,description,interstate,exitnumber,showers,food,fuel,laundry,restrooms,repair,catscale,wifi,security
TA Council Bluffs,truck-stops,3210 South 7th Street,Council Bluffs,IA,51501,712-366-2217,https://www.ta-petro.com/location/ia/ta-council-bluffs/,"Full-service TravelCenters of America travel center on the I-80/I-29 concurrency with a Country Pride restaurant, 78 truck parking spaces and truck service bays.",I-80,3 (I-29/80),yes,yes,yes,,yes,yes,,yes,
Pilot Travel Center #329,truck-stops,2647 South 24th Street,Council Bluffs,IA,51501,712-322-0088,https://locations.pilotflyingj.com/us/ia/council-bluffs/2647-s-24th-st,"24-hour Pilot travel center on the I-80/I-29 concurrency at Exit 1B with Arby's, a CAT Scale, laundry and showers.",I-80,1B (I-29/80),yes,yes,yes,yes,yes,,yes,yes,
Sapp Bros Council Bluffs Travel Center,truck-stops,2608 South 24th Street,Council Bluffs,IA,51501,712-322-3000,https://www.sappbros.net/location/sapp-bros-council-bluffs/,"Independent Sapp Bros travel center on the I-80/I-29 concurrency with the Apple Barrel Restaurant, Burger King, certified scales, truck repair bays and showers.",I-80,1B (I-29/80),yes,yes,yes,yes,yes,yes,,yes,
Love's Travel Stop #426,truck-stops,10 E Street,Shelby,IA,51570,712-207-2441,https://www.loves.com/locations/ia/shelby/loves-travel-stop-shelby-426,"24-hour Love's travel stop at Exit 34 with McDonald's, Chester's, a CAT Scale and showers.",I-80,34,yes,yes,yes,,yes,,yes,yes,
Casey's Travel Center - Stuart,truck-stops,708 S Division Street,Stuart,IA,50250,,,"Casey's-branded travel center at Exit 93 with diesel, a CAT Scale, deli and showers serving the Stuart truck-stop cluster.",I-80,93,yes,yes,yes,,yes,,yes,yes,
Love's Travel Stop #411,truck-stops,11820 Hickman Road,Clive,IA,50325,,https://www.loves.com/locations/411,"24-hour Love's travel stop on the I-35/I-80 concurrency at Exit 125 (former Flying J site) with a Denny's, roughly 280 parking spaces and showers.",I-80,125 (I-35/80),yes,yes,yes,yes,yes,,,yes,
Pilot Travel Center #373,truck-stops,11957 Douglas Avenue,Des Moines,IA,50322,515-276-1509,https://locations.pilotflyingj.com/us/ia/des-moines/11957-douglas-avenue,24-hour Pilot travel center on the I-35/I-80 concurrency at Exit 126 (Urbandale/Douglas Ave) with about 360 parking spaces and 17 showers.,I-80,126 (I-35/80),yes,yes,yes,yes,yes,,,yes,
Flying J Travel Center #913,truck-stops,3231 Adventureland Drive,Altoona,IA,50009,515-967-7878,https://locations.pilotflyingj.com/us/ia/altoona/3231-adventureland-dr,"Large 24-hour Flying J travel plaza at Exit 142 (US-65) with roughly 350 parking spaces, a CAT Scale, laundry and showers.",I-80,142,yes,yes,yes,yes,yes,,yes,yes,
Kum & Go #32 Colfax,truck-stops,1200 N Walnut Street,Colfax,IA,50054,,https://locations.kumandgo.com/ia/colfax,"Kum & Go fuel stop at Exit 155 with diesel, bulk DEF and limited truck parking (about 3 spaces).",I-80,155,,yes,yes,,yes,,,,
Love's Travel Stop #361,truck-stops,4400 S 22nd Ave E,Newton,IA,50208,641-791-2410,https://www.loves.com/locations/ia/newton/loves-travel-stop-newton-361,"24-hour Love's travel stop at Exit 168 (Newton) with a CAT Scale, fast food and showers.",I-80,168,yes,yes,yes,,yes,,yes,yes,
CAT Scale - Pilot Travel Center #329,cat-scales,2647 South 24th Street,Council Bluffs,IA,51501,,https://catscale.com/cat-scale-locator/,Certified CAT Scale located at the Pilot Travel Center on the I-80/I-29 concurrency at Exit 1B.,I-80,1B (I-29/80),,,,,,,yes,,
CAT Scale - Love's Travel Stop #426,cat-scales,10 E Street,Shelby,IA,51570,712-207-2441,https://catscale.com/cat-scale-locator/,Certified CAT Scale at the Love's travel stop at Exit 34.,I-80,34,,,,,,,yes,,
CAT Scale - Stuart,cat-scales,708 S Division Street,Stuart,IA,50250,515-523-1003,https://catscale.com/cat-scale-locator/,Certified CAT Scale at the Casey's travel center at Exit 93.,I-80,93,,,,,,,yes,,
CAT Scale - Flying J Travel Center #913,cat-scales,3231 Adventureland Drive,Altoona,IA,50009,,https://catscale.com/cat-scale-locator/,Certified CAT Scale at the Flying J travel center at Exit 142.,I-80,142,,,,,,,yes,,
CAT Scale - Love's Travel Stop #361,cat-scales,4400 S 22nd Ave E,Newton,IA,50208,641-791-2410,https://catscale.com/cat-scale-locator/,Certified CAT Scale at the Love's travel stop at Exit 168 in Newton.,I-80,168,,,,,,,yes,,
Blue Beacon Truck Wash of Council Bluffs,truck-washes,2608 S 24th Street,Council Bluffs,IA,51501,712-322-7484,https://bluebeacon.com/locations/categories/iowa,"Blue Beacon truck wash at the Sapp Bros site on the I-80/I-29 concurrency at Exit 1B, offering tractor-trailer washes and washout bays.",I-80,1B (I-29/80),,,,,,,,,
Blue Beacon Truck Wash of Des Moines (Altoona),truck-washes,3301 Adventureland Drive,Altoona,IA,50009,515-967-0141,https://bluebeacon.com/locations/categories/iowa,"Blue Beacon truck wash near the Flying J at Exit 142 offering truck and trailer washes, undercarriage rinse and tire dressing.",I-80,142,,,,,,,,,
Speedco #912 (Love's),tire-repair,2423 S 24th Street,Council Bluffs,IA,51501,712-388-0577,https://www.loves.com/locations/ia/council-bluffs/loves-speedco-council-bluffs-912,"Love's-operated Speedco service center on the I-80/I-29 concurrency at Exit 1B offering tires, oil changes, light mechanical work and roadside assistance.",I-80,1B (I-29/80),,,,,,yes,,,
Sapp Bros Council Bluffs Service Center,roadside-service,2608 S 24th Street,Council Bluffs,IA,51501,712-322-3000,https://www.sappbros.net/location/council-bluffs-ia-service-center/,"Sapp Bros truck repair and 24-hour road service with service/lube bays, three-axle alignment and Goodyear/Michelin national account service at Exit 1B.",I-80,1B (I-29/80),,,,,,yes,,,
Van Meter Weigh Station (I-80 Eastbound),weigh-stations,,Van Meter,IA,,,https://www.511ia.org/weighStations/van-meter-weigh-station,"Iowa DOT eastbound weigh station on I-80 near Van Meter at approximately mile marker 115, west of the Des Moines metro.",I-80,,,,,,,,,,
Jasper Weigh Station (I-80 Westbound),weigh-stations,,Mitchellville,IA,,,https://www.coopsareopen.com/iowa-truck-scale-261.html,"Iowa DOT westbound weigh station on I-80 in Jasper County near mile marker 150, east of Mitchellville and the Colfax exits.",I-80,,,,,,,,,,
I-80 Adair Rest Area (Westbound),parking,,Adair,IA,50002,,https://www.iowarestareas.com/ia-i80-interstate-80-adair-rest-area-westbound-mile-marker-80/,"Iowa DOT westbound rest area at about mile marker 80 near Adair with designated truck parking, restrooms, Wi-Fi and a pet area.",I-80,,,,,,yes,,,yes,
I-80 Adair Rest Area (Eastbound),parking,,Adair,IA,50002,,https://www.iowarestareas.com/ia-i80-interstate-80-adair-rest-area-eastbound-mile-marker-81/,"Iowa DOT eastbound rest area at about mile marker 81 near Adair with truck parking, restrooms, Wi-Fi, RV dump and a pet area.",I-80,,,,,,yes,,,yes,
